{
  "schema": "ophiolite.well-tops/1",
  "representation": "normalized",
  "source": {
    "authority": "ophiolite:uploaded",
    "key": "synthetic-tops",
    "revision": "7bca6c523913b58113d3fa23aa97424ce907af3b27915c18ada91b845b71a594",
    "profile": "well-tops-csv/1"
  },
  "source_sha256": "7bca6c523913b58113d3fa23aa97424ce907af3b27915c18ada91b845b71a594",
  "interpretation": {
    "reader": "asset_connectors.typed_reader/1",
    "mapping": "well-tops/1",
    "parsing_policy": "typed-strict/1",
    "null_policy": "empty cell or declared NODATA value is missing; never zero-filled"
  },
  "context": {
    "type": "well-tops",
    "depth_unit": "M",
    "depth_basis": "same-as-log",
    "count": 2,
    "tvd_provided": true,
    "md_range": [
      100.5,
      103.0
    ],
    "fidelity": {
      "status": "assessed",
      "preserved": [
        "names",
        "measured depths",
        "vertical depths as provided",
        "source labels",
        "source order including repeated names"
      ],
      "losses": [
        "Text formatting (whitespace, quoting, line endings, number spelling) is kept only in the exact original"
      ],
      "unknown_context": []
    }
  },
  "tops": [
    {
      "name": "Top Chalk",
      "md": 100.5,
      "tvd": null,
      "source": "picked"
    },
    {
      "name": "Base Chalk",
      "md": 103.0,
      "tvd": 102.9,
      "source": null
    }
  ]
}
